Pair,Session,Interlocutor,Initial time,Transcription,Joint decision,Transcriber
Pair7,1,B,(0:34:51.6) ,"Det er den, samme som vi havde der før. Men den har bare ikke prikkerne. Og hvis den havde haft prikkerne, så havde den været en 2'er. Det var den, vi havde før også.",79,Anne Sofie
Pair7,1,A,(0:34:59.1) ,Ja.,79,Anne Sofie
Pair7,1,B,(0:35:00.2) ,Og nu har den ikke prikkerne.,79,Anne Sofie
Pair7,1,A,(0:35:01.1) ,"Fordi den havde store arme, var blå med prikker, ikk?",79,Anne Sofie
Pair7,1,B,(0:35:02.7) ,Jo.,79,Anne Sofie
Pair7,1,A,(0:35:04.6) ,"Altså jeg tror, det er en 4'er.",79,Anne Sofie
Pair7,1,B,(0:35:06.1) ,"Når den ikke har.. jamen så er prikkerne jo en god ting, kan man sige.",79,Anne Sofie
Pair7,1,A,(0:35:09.5) ,"Neej, okay, så er det nok en 2'er.. Nej!.",79,Anne Sofie
Pair7,1,B,(0:35:13.9) ,"Altså den, der var helt magen til den her, bare med prikker   det var en 2'er. Og hvis vi så siger, at når den ikke har prikker, er det en 4'er, så siger vi jo egentlig at..",79,Anne Sofie
Pair7,1,A,(0:35:22.6) ,"..At prikker er gode, og det har vi ikke gået med..",79,Anne Sofie
Pair7,1,B,(0:35:24.1) ,Ja i hvert fald i den her sammenhæng.,79,Anne Sofie
Pair7,1,A,(0:35:26.3) ,"Øhm, eller også er det en friendly. Men den (?)",79,Anne Sofie
Pair7,1,B,(0:35:29.8) ,"Nej, det tror jeg ikke. Det er altid, når de har tynde arme, at de er friendly.",79,Anne Sofie
Pair7,1,A,(0:35:32.4) ,"Ja.. Altså hvad tænker du, 4 så, eller?",79,Anne Sofie
Pair7,1,B,(0:35:35.1) ,Jamen jeg er lidt lost på den her..,79,Anne Sofie
Pair7,1,A,(0:35:36.8) ,Lad os prøve med 4.,79,Anne Sofie
Pair7,1,B,(0:35:38.3) ,Okay.,79,Anne Sofie
Pair7,1,B,(0:35:51.5) ,"Altså der er jeg på en 1'er igen. (?). Det er bare hver gang, jeg ser de små øjne der..",80,Anne Sofie
Pair7,1,A,(0:35:53.4) ,"Ja, men det er du også virkelig god til. Jeg har bare lyst til at dræbe dem.",80,Anne Sofie
Pair7,1,B,(0:35:57.8) ,Eller hvad hedder det.. De små arme der.. Det tror jeg altså..,80,Anne Sofie
Pair7,1,A,(0:36:05.8) ,Det er den samme som før.,81,Anne Sofie
Pair7,1,B,(0:36:14.4) ,"Den er jo magen til den, vi havde, som var en 2'er.",81,Anne Sofie
Pair7,1,A,(0:36:16.6) ,Som var.. (?),81,Anne Sofie
Pair7,1,B,(0:36:17.3) ,"Neej, jeg kan ikke huske det, havde den ikke tynde ben?",81,Anne Sofie
Pair7,1,A,(0:36:18.7) ,...Der havde tynde ben..,81,Anne Sofie
Pair7,1,B,(0:36:19.1) ,Ja.,81,Anne Sofie
Pair7,1,A,(0:36:19.2) ,"Men, ift. vores teori, så er tykke ben et positivt tegn. Jeg vil..",81,Anne Sofie
Pair7,1,B,(0:36:23.9) ,Sige det er en 2'er?,81,Anne Sofie
Pair7,1,A,(0:36:24.7) ,Det ville jeg prøve.,81,Anne Sofie
Pair7,1,A,(0:36:30.7) ,2.. Er min umiddelbare reaktion,82,Anne Sofie
Pair7,1,B,(0:36:32.7) ,Ja! Helt klart!,82,Anne Sofie
Pair7,1,A,(0:36:37.8) ,"Så det er en 1'er, eller hvad?",83,Anne Sofie
Pair7,1,B,(0:36:38.8) ,"Ja, det vil jeg sige.",83,Anne Sofie
Pair7,1,A,(0:36:39.5) ,Men så lad os prøve.,83,Anne Sofie
Pair7,1,A,(0:36:45.5) ,Øhm. 4 vil jeg tro.,84,Anne Sofie
Pair7,1,B,(0:36:47.3) ,"Det var den, vi havde før, var det ikke?",84,Anne Sofie
Pair7,1,A,(0:36:49.3) ,Men den var faktisk en 2'er.,84,Anne Sofie
Pair7,1,B,(0:36:50.1) ,(?) ..ja.. (?),84,Anne Sofie
Pair7,1,A,(0:36:51.8) ,Fordi der var to positive enheder.,84,Anne Sofie
Pair7,1,B,(0:36:53.0) ,"Ja. Jeg tror også, det er en 2'er den der.",84,Anne Sofie
Pair7,1,A,(0:36:54.5) ,Lad os prøve!,84,Anne Sofie
Pair7,1,B,(0:37:00.2) ,1?,85,Anne Sofie
Pair7,1,A,(0:37:01.2) ,Lad os gøre det.,85,Anne Sofie
Pair7,1,B,(0:37:02.7) ,Det er de arme der!,86,Anne Sofie
Pair7,1,A,(0:37:03.7) ,"Jå, jeg tror du har ret, for der har virkelig været mange forskellige nu! ..1'er igen så.",86,Anne Sofie
Pair7,1,B,(0:37:06.9) ,"Men har vi overhovedet tænkt at, hvis den har.. Altså for eksempel armene hører til 1'eren, .. hvis den har store ben indholdet, så hører den til én gruppe. For hver gang den har de små arme, så hører den jo til gruppe 1.",86,Anne Sofie
Pair7,1,A,(0:37:23.2) ,"Jeg tror,at de andre er mere i kombinationer.",86,Anne Sofie
Pair7,1,B,(0:37:25.9) ,Jamen det kan godt være.,86,Anne Sofie
Pair7,1,A,(0:37:26.4) ,"Fordi når vi tænker over, hvordan vi har gjort det ift. 2'eren, der er det jo ikke altid, den har haft store ben. Der har vi nogle gange sagt, at når den er ensfarvet og store øjne..",86,Anne Sofie
Pair7,1,B,(0:37:33.3) ,Jamen har den så altid haft de samme øjne? Nej det har den heller ikke.,86,Anne Sofie
Pair7,1,A,(0:37:36.2) ,Nej..,86,Anne Sofie
Pair7,1,B,(0:37:36.9) ,"Nej, men det kan sgu godt være..",86,Anne Sofie
Pair7,1,A,(0:37:38.2) ,Jeg tror bare..,86,Anne Sofie
Pair7,1,B,(0:37:38.6) ,"Nå, men det der er en 1'er i hvert fald.",86,Anne Sofie
Pair7,1,A,(0:37:39.4) ,Ja.,86,Anne Sofie
Pair7,1,B,(0:37:44.4) ,1,87,Anne Sofie
Pair7,1,B,(0:37:46.3) ,"Ja, men (?).. det er 100%",88,Anne Sofie
Pair7,1,A,(0:37:53.4) ,"Det er den samme som den der, bare i grøn.",89,Anne Sofie
Pair7,1,B,(0:37:54.8) ,Er den det?,89,Anne Sofie
Pair7,1,A,(0:37:55.4) ,"Ja... Nej, den havde også uhyggelige øjne. Men den der, ville jeg rent faktisk sige en 4'er til.",89,Anne Sofie
Pair7,1,B,(0:38:02.9) ,Fordi den har to af hver?,89,Anne Sofie
Pair7,1,A,(0:38:04.0) ,"Mmhh. og så med farven, der ved man aldrig rigtig helt.",89,Anne Sofie
Pair7,1,B,(0:38:07.0) ,Vi kan godt prøve 4.,89,Anne Sofie
Pair7,1,B,(0:38:18.9) ,Altså der vil jeg også sige 4.,90,Anne Sofie
Pair7,1,A,(0:38:21.8) ,Ja.. Eller 3.,90,Anne Sofie
Pair7,1,B,(0:38:25.0) ,3?,90,Anne Sofie
Pair7,1,A,(0:38:25.9) ,4,90,Anne Sofie
Pair7,1,B,(0:38:30.2) ,2?,91,Anne Sofie
Pair7,1,A,(0:38:30.9) ,"Ja, men (?). Der er det en 2'er så.",91,Anne Sofie
Pair7,1,B,(0:38:34.4) ,"Ja, det må det være.",91,Anne Sofie
Pair7,1,A,(0:38:39.3) ,1'eren!,92,Anne Sofie
Pair7,1,B,(0:38:46.7) ,"Okay, nu er den bare helt standard.",93,Anne Sofie
Pair7,1,A,(0:38:47.7) ,"Ja, men er det 1 eller 2? Er det så en 1'er?",93,Anne Sofie
Pair7,1,B,(0:38:50.8) ,"Nej, det er en 1'er. Det tror jeg. Jeg holder på 1.",93,Anne Sofie
Pair7,1,A,(0:38:53.4) ,Gør det!,93,Anne Sofie
Pair7,1a,A,(0:39:34.2) ,"Der er mange flere indikatorer her, er der ikke det?",1,Anne Sofie
Pair7,1a,B,(0:39:36.9) ,"Jo, men der er også noget med de der haler der i hvert fald.",1,Anne Sofie
Pair7,1a,A,(0:39:38.6) ,"Nej, halerne kan man godt sige, at hvis man tager den ift. tynd; så er det der eksempelvis en dårlig én, og det der er en god én, fordi den har en tyk hale. Og tykke arme.",1,Anne Sofie
Pair7,1a,B,(0:39:49.3) ,Ja.,1,Anne Sofie
Pair7,1a,A,(0:39:50.1) ,"Og så, hvis vi tænker på, hvad vi gjorde før.",1,Anne Sofie
Pair7,1a,B,(0:39:51.7) ,Ja så bare køre den samme?,1,Anne Sofie
Pair7,1a,A,(0:39:53.2) ,"Ja, altså det er vel det, vi skal gøre..",1,Anne Sofie
Pair7,1a,B,(0:39:55.7) ,"Ja, men jeg tror også, vi skal starte med lige at prøve den i hvert fald. Men hvor mange er der, af haler, der er to. Okay, der er to af hver, ikk?",1,Anne Sofie
Pair7,1a,A,(0:40:02.8) ,"Ja.. Nej, der er tre forskellige munde",1,Anne Sofie
Pair7,1a,B,(0:40:07.0) ,Var der?,1,Anne Sofie
Pair7,1a,A,(0:40:07.3) ,Ja.,1,Anne Sofie
Pair7,1a,B,(0:40:09.8) ,Okay.,1,Anne Sofie
Pair7,1a,A,(0:40:10.8) ,Det er en 3'er!,1,Anne Sofie
Pair7,1a,B,(0:40:13.0) ,Den har..,1,Anne Sofie
Pair7,1a,A,(0:40:13.7) ,"Den har prikker, den har uhyggelige øjne, tynde arme, tynd hale, negativ mund.",1,Anne Sofie
Pair7,1a,B,(0:40:18.0) ,"Jamen der var da ikke nogen, der havde gode øjne, var der?",1,Anne Sofie
Pair7,1a,A,(0:40:21.0) ,"Jo. Der var nogen, der havde nogen små runde hvide (?)",1,Anne Sofie
Pair7,1a,B,(0:40:23.5) ,"Nårh okay. Okay, så du vil sige 3 til den der?",1,Anne Sofie
Pair7,1a,A,(0:40:26.3) ,"Ud fra hvad vi har baseret de andre på, så vil jeg sige en 3'er til den her.",1,Anne Sofie
Pair7,1a,B,(0:40:29.9) ,"Ja, en lille hale, store arme, runde øjne, prikker.. Ja, det er nok rigtigt.",1,Anne Sofie
Pair7,1a,B,(0:40:47.3) ,"Okay, den har en stor mund..",2,Anne Sofie
Pair7,1a,A,(0:40:48.6) ,Jeg vil stadig sige en 3'er..,2,Anne Sofie
Pair7,1a,B,(0:40:50.1) ,"Jamen det er jo fordi, de allesammen ser onde ud nu.",2,Anne Sofie
Pair7,1a,A,(0:40:51.5) ,"Så tag en 4'er.. (?) tynde arme, så er det en 1'er!",2,Anne Sofie
Pair7,1a,B,(0:40:57.1) ,Det kan godt være..,2,Anne Sofie
Pair7,1a,A,(0:41:04.3) ,Lad os prøve en 1'er! Det har vi holdt rigtig mange af de andre på. det er kun gået galt én gang.,2,Anne Sofie
Pair7,1a,A,(0:41:12.1) ,Det er en 2'er.,3,Anne Sofie
Pair7,1a,B,(0:41:12.8) ,Det er i hvert fald tykke arme. Og den har nogle nederen øjne..,3,Anne Sofie
Pair7,1a,A,(0:41:18.6) ,Men det er alligevle nogle sødere øjne.,3,Anne Sofie
Pair7,1a,B,(0:41:20.0) ,"Ja, det er det.",3,Anne Sofie
Pair7,1a,A,(0:41:20.7) ,"Og det var også det, vi baserede det andet på.",3,Anne Sofie
Pair7,1a,B,(0:41:21.9) ,Og halen er lille. Og munden..,3,Anne Sofie
Pair7,1a,A,(0:41:24.8) ,Er stor.,3,Anne Sofie
Pair7,1a,B,(0:41:25.6) ,Er stor.. Stor. Stor. Stor.,3,Anne Sofie
Pair7,1a,A,(0:41:26.5) ,"Ørerne er skøre, og armene er (?)",3,Anne Sofie
Pair7,1a,B,(0:41:28.8) ,"Jeg tror, det er en 2'er!",3,Anne Sofie
Pair7,1a,A,(0:41:29.2) ,"Jeg tror også, det er en 2'er!",3,Anne Sofie
Pair7,1a,A,(0:41:35.0) ,"Okay, er der fire forskellige munde?!",4,Anne Sofie
Pair7,1a,B,(0:41:40.7) ,"Jeg kan huske, der var den lille, den store, og så er der nogen, hvor der ikke er så mange pløkker i..",4,Anne Sofie
Pair7,1a,A,(0:41:44.5) ,Ja..,4,Anne Sofie
Pair7,1a,B,(0:41:46.9) ,Men har de ikke også forskellige farver de der..,4,Anne Sofie
Pair7,1a,A,(0:41:48.5) ,"Jo, prikkerne har også forskellige farver..",4,Anne Sofie
Pair7,1a,B,(0:41:49.9) ,"Ja, den der ser lidt halvgiftig ud.",4,Anne Sofie
Pair7,1a,A,(0:41:52.0) ,4? 4 måske? 2'eren!,4,Anne Sofie
Pair7,1a,B,(0:41:55.8) ,"Den har store arme, og øjne, og hale.",4,Anne Sofie
Pair7,1a,A,(0:41:59.3) ,Ja.,4,Anne Sofie
Pair7,1a,B,(0:42:01.0) ,Og så har den nogle giftige prikker. Jeg vil sige 2 eller 4.,4,Anne Sofie
Pair7,1a,A,(0:42:07.0) ,4. Tror jeg.,4,Anne Sofie
Pair7,1a,A,(0:42:13.6) ,1!,5,Anne Sofie
Pair7,1a,B,(0:42:15.4) ,På grund af armene?,5,Anne Sofie
Pair7,1a,A,(0:42:16.1) ,Ja.,5,Anne Sofie
Pair7,1a,B,(0:42:26.7) ,"Okay, den her.. Det kan være, de har byttet rundt på det nu, så store arme, det er 1'ere..?",6,Anne Sofie
Pair7,1a,A,(0:42:31.5) ,Så prøv det.,6,Anne Sofie
Pair7,1a,B,(0:42:33.0) ,Skal vi prøve det?,6,Anne Sofie
Pair7,1a,A,(0:42:33.6) ,Ja.,6,Anne Sofie
Pair7,1a,A,(0:42:39.2) ,"2. Jeg ved det ikke, jeg synes virkelig det er svært nu.",7,Anne Sofie
Pair7,1a,B,(0:42:42.1) ,Altså jeg er også helt lost.,7,Anne Sofie
Pair7,1a,A,(0:42:44.2) ,"Det er som om, de der ører, de har været der før, men der var de stoerre.",7,Anne Sofie
Pair7,1a,B,(0:42:47.2) ,"Ja. Okay, så har den små arme og små..",7,Anne Sofie
Pair7,1a,A,(0:42:52.3) ,"En stor hale, stor mund, store øjne, store ører, prikker.. Grøn... 2!",7,Anne Sofie
Pair7,1a,B,(0:43:05.6) ,"Okay, havde den store øjne, den anden?",8,Anne Sofie
Pair7,1a,A,(0:43:07.0) ,Ja.,8,Anne Sofie
Pair7,1a,B,(0:43:09.0) ,"Og så havde den prikker også. Og den havde også de små.. tentakler der, eller hvad de hedder..",8,Anne Sofie
Pair7,1a,A,(0:43:13.3) ,Ja.,8,Anne Sofie
Pair7,1a,B,(0:43:14.7) ,"Og den havde også samme mund, havde den ikke?",8,Anne Sofie
Pair7,1a,A,(0:43:18.4) ,"Jo. Nej.. En der mindede om (?) hvert fald. Jeg tror bare, at tænderne sad i overmunden, måske. Jeg tror, det er en 1'er.",8,Anne Sofie
Pair7,1a,B,(0:43:26.8) ,En 1'er?,8,Anne Sofie
Pair7,1a,A,(0:43:27.3) ,Ja... Jeg har ingen anelse overhovedet.,8,Anne Sofie
Pair7,1a,B,(0:43:33.7) ,Jeg hælder mere til 2.,8,Anne Sofie
Pair7,1a,A,(0:43:34.8) ,2 kan jeg også sagtens stå inden for.,8,Anne Sofie
Pair7,2,B,(0:44:00.7) ,"Normalt, der vil jeg sige 1 der jo. Skal vi prøve at se, om det stadig er 1?",1,Anne Sofie
Pair7,2,A,(0:44:04.3) ,"Ja, lad os prøve. Det kan være, nogen af tingene fortsætter.",1,Anne Sofie
Pair7,2,A,(0:44:08.1) ,"Nej, det kan være, at øhh...",2,Anne Sofie
Pair7,2,B,(0:44:10.7) ,"Nu så jeg så ikke lige, hvad det var.",2,Anne Sofie
Pair7,2,A,(0:44:11.2) ,"...At skræmmebilledet det var en 2'er. Det kan være, at skræmmebilledet har vendt sig om. Alle de røde indikatorer har været positive faktisk.",2,Anne Sofie
Pair7,2,B,(0:44:18.2) ,Hvad så med sådan en der? Fordi det vil jeg jo sige er en 2'er eller en 4'er. Nej det vil jeg sige er en 4'er.,2,Anne Sofie
Pair7,2,A,(0:44:23.6) ,"Ja, men så kan det være, det stadigvæk er en 4'er.",2,Anne Sofie
Pair7,2,B,(0:44:25.1) ,Hvor den bare er byttet rundt der?,2,Anne Sofie
Pair7,2,A,(0:44:26.1) ,Ja.,2,Anne Sofie
Pair7,2,A,(0:44:30.2) ,"Vi skal bare vende vores tankegang om, så det der vil være en 2'er.. Fordi der er prikker og arme, og..",3,Anne Sofie
Pair7,2,B,(0:44:35.4) ,"Nej, så vil jeg sige, at den skal kill'es, fordi friendly og kill, det må være modsætninger af hinanden.",3,Anne Sofie
Pair7,2,A,(0:44:41.4) ,"Nååårrhh. Men! ..jo. Men så går den måske meget på armene. Så skal vi måske vende det om i stedet for, så det hedder at, tykke arme skal være friendly, og så kan tynde arme stadig godt være en indikator for værdi indeni, som vi gjorde før.",3,Anne Sofie
Pair7,2,B,(0:44:53.6) ,"Ja, det er selvfølgelig rigtigt. Okay, men så har den...",3,Anne Sofie
Pair7,2,A,(0:44:58.8) ,"Så har den en, to, tre plus.",3,Anne Sofie
Pair7,2,B,(0:45:00.6) ,Tre gode ting og en.. Nej..,3,Anne Sofie
Pair7,2,A,(0:45:02.6) ,Og en dårlig.,3,Anne Sofie
Pair7,2,B,(0:45:04.5) ,"En dårlig, ja.",3,Anne Sofie
Pair7,2,A,(0:45:05.3) ,"Ja. Men tre gode ting. Så det der ville være en 2'er, hvis altså den omvendte teori, skal...",3,Anne Sofie
Pair7,2,B,(0:45:09.9) ,Ja.. Skal vi prøve det?,3,Anne Sofie
Pair7,2,B,(0:45:12.5) ,Det er sgu rigtigt.,4,Anne Sofie
Pair7,2,A,(0:45:16.6) ,"Så det.. Aj, jeg har lyst til bare at sige en 2'er.",4,Anne Sofie
Pair7,2,B,(0:45:18.1) ,"Den har jo alt negativt, på nær armene.",4,Anne Sofie
Pair7,2,A,(0:45:20.4) ,Så det er en 3'er.,4,Anne Sofie
Pair7,2,B,(0:45:22.6) ,Det vil jeg sige.,4,Anne Sofie
Pair7,2,A,(0:45:24.3) ,Hit it!,4,Anne Sofie
Pair7,2,B,(0:45:26.2) ,Friendly?!,5,Anne Sofie
Pair7,2,A,(0:45:27.9) ,Tykke ben kan være friendly!,5,Anne Sofie
Pair7,2,B,(0:45:31.3) ,Ja okay.,5,Anne Sofie
Pair7,2,A,(0:45:31.6) ,"Men.. Hvis vi tager den anden, så skal det der være friendly.",5,Anne Sofie
Pair7,2,B,(0:45:35.5) ,"Okay, men den der..",5,Anne Sofie
Pair7,2,A,(0:45:37.1) ,Den har to gode ting.,5,Anne Sofie
Pair7,2,B,(0:45:40.2) ,Og to dårlige.,5,Anne Sofie
Pair7,2,A,(0:45:41.2) ,"Ja. Og så farven, det er vel bare stadigvæk neutralt.",5,Anne Sofie
Pair7,2,B,(0:45:44.1) ,Så må det være en 4'er eller hvad? Skal vi sige det?,5,Anne Sofie
Pair7,2,A,(0:45:46.2) ,Prøv!,5,Anne Sofie
Pair7,2,B,(0:45:48.8) ,"Okay, men så går vi efter benene. Skal vi ikke prøve det?",6,Anne Sofie
Pair7,2,A,(0:45:51.2) ,Altså ift. friendly eller ej? Så tykke ben det er friendly?,6,Anne Sofie
Pair7,2,B,(0:45:54.0) ,"Ja, det tror jeg.",6,Anne Sofie
Pair7,2,A,(0:45:54.5) ,"Så det der, det er en 4'er.. Nej 2'er! Der er tre gode enheder.",6,Anne Sofie
Pair7,2,B,(0:45:59.8) ,Prikker (?),6,Anne Sofie
Pair7,2,B,(0:46:06.9) ,Det burde så være en..,7,Anne Sofie
Pair7,2,A,(0:46:08.0) ,En 4'er!,7,Anne Sofie
Pair7,2,B,(0:46:09.3) ,"Det er så der, jeg siger 1. Fordi den har store ben.",7,Anne Sofie
Pair7,2,A,(0:46:12.3) ,Så hit it! Lad os prøve.,7,Anne Sofie
Pair7,2,A,(0:46:20.8) ,"Øhhmm... 4. Men! Det kan også være, at store arme.. (?)",8,Anne Sofie
Pair7,2,B,(0:46:26.4) ,"Men det tror jeg.. Har vi ikke prøvet det? Det kan være, det er.. Nej, det er heller ikke prikkerne..",8,Anne Sofie
Pair7,2,A,(0:46:31.3) ,"Jeg vil jo umiddelbart sige 4, fordi det er en..",8,Anne Sofie
Pair7,2,B,(0:46:34.1) ,"Jeg vil sige 2, fordi den har kun én dårlig ting.",8,Anne Sofie
Pair7,2,A,(0:46:36.9) ,"Okay, prøv 2'eren.",8,Anne Sofie
Pair7,2,A,(0:46:41.6) ,"Okay, så det kan være, at hvad vi før tilgav øjnene af værdo, nu er armene. For før sagde vi, at øjnene ligesom spended lidt højere.",9,Anne Sofie
Pair7,2,B,(0:46:49.2) ,Ja.,9,Anne Sofie
Pair7,2,A,(0:46:50.1) ,"Det kan være, at.. Så kan det være..",9,Anne Sofie
Pair7,2,B,(0:46:53.2) ,"Men så må den der være god jo.. Nej, den har..",9,Anne Sofie
Pair7,2,A,(0:46:57.6) ,Den har lige meget af begge dele.,9,Anne Sofie
Pair7,2,B,(0:46:58.9) ,Ja den har.,9,Anne Sofie
Pair7,2,A,(0:46:59.7) ,4!,9,Anne Sofie
Pair7,2,A,(0:47:03.3) ,"Små øjne! Små øjne må det være! Små øjne må være friendly, med mindre at..",10,Anne Sofie
Pair7,2,B,(0:47:07.9) ,Jamen har vi ikke haft den før?,10,Anne Sofie
Pair7,2,A,(0:47:08.8) ,Jeg ved det ikke..,10,Anne Sofie
Pair7,2,B,(0:47:11.8) ,"Okay, så den der, den skulle være friendly?",10,Anne Sofie
Pair7,2,A,(0:47:13.1) ,Ja.,10,Anne Sofie
Pair7,2,B,(0:47:13.9) ,Skal vi prøve?,10,Anne Sofie
Pair7,2,A,(0:47:14.3) ,Ja.,10,Anne Sofie
Pair7,2,B,(0:47:16.8) ,"Okay, den er bare helt ond den der.",10,Anne Sofie
Pair7,2,A,(0:47:19.5) ,"Nej, for den har prikker.",10,Anne Sofie
Pair7,2,B,(0:47:22.3) ,"Nårh ja, det er rigtigt.",10,Anne Sofie
Pair7,2,A,(0:47:23.1) ,Prøv 1'eren. Jeg tror det kunne være en mulighed.,10,Anne Sofie
Pair7,2,A,(0:47:31.8) ,Er det prikkerne måske?,11,Anne Sofie
Pair7,2,B,(0:47:35.0) ,Havde den ikke prikker den der?,11,Anne Sofie
Pair7,2,A,(0:47:36.1) ,Jo.,11,Anne Sofie
Pair7,2,B,(0:47:36.9) ,"Så den er, den skulle så være en 1'er?",11,Anne Sofie
Pair7,2,A,(0:47:39.4) ,Ja.,11,Anne Sofie
Pair7,2,B,(0:47:40.6) ,Det kan sgu godt være. Skal vi prøve det?,11,Anne Sofie
Pair7,2,A,(0:47:42.6) ,Ja.,11,Anne Sofie
Pair7,2,B,(0:47:43.2) ,Hvad har den...?,11,Anne Sofie
Pair7,2,A,(0:47:47.7) ,"Store øjne, store ben, tynde arme.",11,Anne Sofie
Pair7,2,B,(0:47:50.6) ,"Ja.. Umiddelbart vil jeg sige, det er ern 2'er, men vi kan godt lige prøve 1'eren og se, om det er..",11,Anne Sofie
Pair7,2,A,(0:47:54.6) ,"Jeg tror ikke, det er en 2'er, fordi den eneste positive ting den har, det er tynde arme.",11,Anne Sofie
Pair7,2,B,(0:47:59.7) ,"Nårh ja, det er rigtigt, jeg vender den rundt!",11,Anne Sofie
Pair7,2,B,(0:48:02.4) ,"Okay, men så vil jeg sige, det var en 3'er, men vi prøver lige med 1'eren, og ser om det er prikkerne.",11,Anne Sofie
Pair7,2,A,(0:48:06.1) ,Lad os prøve en 3'er. Altså vi får jo stadig et svar ud af det..,11,Anne Sofie
Pair7,2,B,(0:48:09.7) ,"Ja, det er selvfølgelig rigtigt. Hvad skal vi tage?",11,Anne Sofie
Pair7,2,A,(0:48:13.1) ,3,11,Anne Sofie
Pair7,2,B,(0:48:16.8) ,"Okay, så der er noget med prikkerne. Det må der være.. Så det er ikke en 1'er.",12,Anne Sofie
Pair7,2,A,(0:48:20.1) ,"Nej. Det der, det er en.. ..Det er en 4'er.",12,Anne Sofie
Pair7,2,B,(0:48:22.2) ,"Men den har en..to.. gode ting, og så er der to negative, ja.",12,Anne Sofie
Pair7,2,A,(0:48:32.0) ,"Hvad var det nu, vi sagde med prikkerne?",13,Anne Sofie
Pair7,2,B,(0:48:33.1) ,"Når den har prikker, så er det friendly.",13,Anne Sofie
Pair7,2,A,(0:48:35.8) ,"Okay. Så det der, det er en.. 4'er.",13,Anne Sofie
Pair7,2,B,(0:48:37.9) ,Den har en..to... Ja.,13,Anne Sofie
Pair7,2,B,(0:48:51.7) ,"Den har.. Den er jo bare ren ond, den der.",14,Anne Sofie
Pair7,2,A,(0:48:55.7) ,3?,14,Anne Sofie
Pair7,2,B,(0:48:56.6) ,Ja.. Er det ikke det?,14,Anne Sofie
Pair7,2,A,(0:48:57.8) ,Jo.,14,Anne Sofie
Pair7,2,A,(0:49:05.5) ,4. Skulle det så være.. Men det kunne også sagtens være en friendly det der..,15,Anne Sofie
Pair7,2,B,(0:49:09.6) ,Ja...,15,Anne Sofie
Pair7,2,A,(0:49:11.0) ,"Jeg tror i hvert fald ikke, at den skal dræbes.. Det kan også være, at når det er på lige fod   når der er prikker, tynde arme og tykke ben og store øjne, at så er det en (?) ..altså sådan.. Så skal der..",15,Anne Sofie
Pair7,2,B,(0:49:24.8) ,"Ja, men er det ikke der, vi altid kategorerer den som 4 så?",15,Anne Sofie
Pair7,2,A,(0:49:27.6) ,"Jo, men så kan det være, at der, i den her omgang, skal være en ekstra enhed, der spiller over, eller farven spiller ind eller et eller andet..",15,Anne Sofie
Pair7,2,B,(0:49:34.3) ,"Ja, det kan godt være.. Skal vi prøve 1 eller hvad?",15,Anne Sofie
Pair7,2,A,(0:49:35.8) ,"Ja, prøv 1!",15,Anne Sofie
Pair7,2,B,(0:49:49.7) ,"Den har små øjne og prikker, så vil jeg sige, at det er en friendly.",16,Anne Sofie
Pair7,2,A,(0:49:52.1) ,"Jeg vil sige, det er en 2'er.",16,Anne Sofie
Pair7,2,B,(0:49:53.5) ,Det en 2'er? Fordi...,16,Anne Sofie
Pair7,2,A,(0:49:55.1) ,Der er tre gode gode.. Der er tre positive og (?),16,Anne Sofie
Pair7,2,A,(0:50:04.5) ,Jeg vil også sige en 2'er.,17,Anne Sofie
Pair7,2,B,(0:50:08.7) ,"Tre gode og en dårlig, ja.",17,Anne Sofie
Pair7,2,A,(0:50:17.6) ,4! ..2.,18,Anne Sofie
Pair7,2,B,(0:50:21.1) ,"2, ikk?",18,Anne Sofie
Pair7,2,A,(0:50:22.0) ,2,18,Anne Sofie
Pair7,2,B,(0:50:35.4) ,"Okay, den har en..to..tre gode.. Nej dårlige, og en god.",19,Anne Sofie
Pair7,2,A,(0:50:40.2) ,"Ja, 3!",19,Anne Sofie
Pair7,2,A,(0:51:04.8) ,"Okay, to eller mere gode ting.. Altså indikatorer for, at der er jelly, så er det der...",20,Anne Sofie
Pair7,2,B,(0:51:13.8) ,"Okay, men så har den en..to.. gode ting, og to dårlige.",20,Anne Sofie
Pair7,2,A,(0:51:18.2) ,Så vil jeg tage en 4'er.,20,Anne Sofie
Pair7,2,B,(0:51:24.8) ,Den har tre dårlige og en god.,21,Anne Sofie
Pair7,2,A,(0:51:28.4) ,Så er det en 3'er!,21,Anne Sofie
Pair7,2,B,(0:51:29.3) ,Ja.,21,Anne Sofie
Pair7,2,A,(0:51:34.8) ,3!,22,Anne Sofie
Pair7,2,B,(0:51:34.9) ,Og igen..,22,Anne Sofie
Pair7,2,A,(0:51:43.0) ,2'eren.,23,Anne Sofie
Pair7,2,B,(0:51:44.7) ,"Tre gode og en dårlig, ja. Har den ikke? ..jo.",23,Anne Sofie
Pair7,2,B,(0:51:54.8) ,"Tre dårlige, og én god.",24,Anne Sofie
Pair7,2,A,(0:51:56.4) ,3!,24,Anne Sofie
Pair7,2,A,(0:52:02.6) ,4,25,Anne Sofie
Pair7,2,B,(0:52:04.1) ,Ja.,25,Anne Sofie
Pair7,2,A,(0:52:04.6) ,Det er ligemeget.,26,Anne Sofie
Pair7,2,B,(0:52:05.5) ,"Men det er så der, jeg kommer i tvivl om det er en 1'er eller (?)",26,Anne Sofie
Pair7,2,A,(0:52:07.2) ,(?) .. Fordi den er blå.,26,Anne Sofie
Pair7,2,B,(0:52:09.8) ,"Jeg tror, at 4'eren og 1'eren er ens.. Altså det er jo, når de står lige, tror jeg.. Altså når det er to to, men så er der et eller andet..",26,Anne Sofie
Pair7,2,A,(0:52:16.2) ,"Der er et eller andet, der trækker den, ja..",26,Anne Sofie
Pair7,2,B,(0:52:18.1) ,"Som gør, at det er en 1'er eller en 4'er. Og det kan jeg ikke lige helt finde ud af, hvor (?)",26,Anne Sofie
Pair7,2,A,(0:52:22.0) ,"Jeg tror, det er.. Ved session 1, der var det bare en ting, og så kunne jeg godt forestille mig, at session 2 kørte den op, så det pludselig er to ting, der skal kombineres, før det er 1'eren.",26,Anne Sofie
Pair7,2,B,(0:52:34.0) ,Det kan godt være.. Men så er det måske arme og..,26,Anne Sofie
Pair7,2,A,(0:52:38.3) ,"Farve? Nej, fordi farve det siger du, at det ikke er..",26,Anne Sofie
Pair7,2,B,(0:52:39.9) ,"Nej, jeg tror ikke så meget, at det er farven. Den er der bare for at forstyrre..",26,Anne Sofie
Pair7,2,A,(0:52:42.7) ,"Og prikker, det har også været lidt forskelligt.. Men derfor kan det godt være..",26,Anne Sofie
Pair7,2,B,(0:52:46.5) ,"Jamen armene er da ikke.. Jeg tror godt, det kan være prikker og øjne måske.. Men så skulle det være de små øjne, tror jeg.",26,Anne Sofie
Pair7,2,A,(0:52:51.3) ,Men der har jo også været nogen friendly uden prikker..,26,Anne Sofie
Pair7,2,B,(0:52:53.9) ,"Har der det? Nårh ja, det er rigtigt..",26,Anne Sofie
Pair7,2,A,(0:52:56.7) ,"Men der er jo ikke.. Har det ikke virket som om, at det ikke har været én bestemt ting, der har skullet være der før, at det har været friendly, men at det mere har været lidt forskellige kombinationer?",26,Anne Sofie
Pair7,2,B,(0:53:10.7) ,"Det synes jeg ikke lige, at jeg har lagt mærke til..",26,Anne Sofie
Pair7,2,A,(0:53:12.6) ,Hvad med benene?,26,Anne Sofie
Pair7,2,B,(0:53:13.1) ,"Okay, men den der, den har i hvert fald tykke ben, og store øjne.",26,Anne Sofie
Pair7,2,A,(0:53:18.4) ,"To indikatorer for, at det er 2'eren, og to indikatorer for at det er 4'eren.. Jeg tror, at det er en 4'er. Og hvis det ikke er, så tror jeg friendly har noget med benene at gøre..",26,Anne Sofie
Pair7,2,B,(0:53:28.2) ,Med benene?,26,Anne Sofie
Pair7,2,A,(0:53:28.8) ,"Ja, hvis det ikke er en 4'er.",26,Anne Sofie
Pair7,2,A,(0:53:31.2) ,"Så tror jeg, det har noget med benene at gøre.",27,Anne Sofie
Pair7,2,B,(0:53:32.1) ,"Okay, så når de er store, så tager vi friendly.",27,Anne Sofie
Pair7,2,A,(0:53:34.1) ,"Ja. Altså hvis det ligger lige på vippen, ikk?",27,Anne Sofie
Pair7,2,B,(0:53:36.1) ,Ja.,27,Anne Sofie
Pair7,2,A,(0:53:37.1) ,"Det der, det er en 4'er... God, god, dårlig, dårlig",27,Anne Sofie
Pair7,2,B,(0:53:41.2) ,Ja. ..Og så små ben,27,Anne Sofie
Pair7,2,A,(0:53:59.7) ,"Det der, det er i hvet fald en 2'er.",28,Anne Sofie
Pair7,2,B,(0:54:01.4) ,"Men det er jo den samme igen, er det ikke?",28,Anne Sofie
Pair7,2,A,(0:54:02.2) ,Nej..,28,Anne Sofie
Pair7,2,B,(0:54:03.2) ,"Dårlig, dårlig, dårlig.. Nårh (?)",28,Anne Sofie
Pair7,2,A,(0:54:07.9) ,"Hvis den ligger på vippen, og øjnene er store.. Det der, det er en.. Det er sgu en 3'er.",29,Anne Sofie
Pair7,2,B,(0:54:11.4) ,Det er en 3'er.,29,Anne Sofie
Pair7,2,B,(0:54:18.9) ,"Ehm, dårlig, dårlig, dårlig.. Det er en 3'er.",29,Anne Sofie
Pair7,2,A,(0:54:20.7) ,Det er en 3'er.,29,Anne Sofie
Pair7,2,A,(0:54:27.6) ,4!,30,Anne Sofie
Pair7,2,B,(0:54:27.8) ,"Dårlig, dårlig.. 4? For den har store ben. Eller nej, det..",30,Anne Sofie
Pair7,2,A,(0:54:31.8) ,Den har prikker og små øjne.,30,Anne Sofie
Pair7,2,B,(0:54:33.8) ,Små øjne? Så vi går efter øjnene nu?,30,Anne Sofie
